{
  "title": "Sector Rotation\nIs Accelerating",
  "subtitle": "Where institutional capital is flowing in Q1 2026",
  "series_tag": "MACRO PULSE",
  "date": "MARCH 2026",
  "slides": [
    {
      "type": "context",
      "heading": "What's Happening",
      "icon": "bolt",
      "paragraphs": [
        "Institutional capital is rotating out of crowded AI software plays and into infrastructure bottleneck names.",
        "Power grid, nuclear, and data center REIT stocks are seeing the strongest 13F accumulation since Q3 2024.",
        "The shift accelerated after Anthropic's Cowork launch repriced SaaS workflow tools — investors want picks-and-shovels, not the software being disrupted."
      ],
      "callout": "Follow the infrastructure. When AI eats software, the builders of AI infrastructure are the winners."
    },
    {
      "type": "stats",
      "heading": "The Numbers",
      "icon": "chart_bar",
      "items": [
        { "number": "1,817", "label": "stocks scanned\nby Sterling Grid" },
        { "number": "3", "label": "survived all\nfive gates" },
        { "number": "+42%", "label": "avg winner return\nlast 12 months" },
        { "number": "79%", "label": "system win rate\n(backtest validated)" }
      ]
    },
    {
      "type": "two_column",
      "heading": "Rotation Playbook",
      "icon": "shield",
      "left": {
        "title": "ROTATING OUT",
        "color": "C0392B",
        "items": [
          "Pure-play SaaS workflow tools",
          "Generic CRM platforms",
          "Low-moat AI chatbot wrappers",
          "Overvalued cloud infrastructure",
          "Consumer subscription fatigue plays"
        ]
      },
      "right": {
        "title": "ROTATING INTO",
        "color": "27AE60",
        "items": [
          "Power grid modernization",
          "Nuclear energy renaissance",
          "Data center REITs",
          "AI chip supply chain",
          "Defense & drone technology"
        ]
      }
    },
    {
      "type": "takeaway",
      "heading": "The Takeaway",
      "icon": "lightbulb",
      "items": [
        {
          "title": "Infrastructure is the new growth trade.",
          "body": "Every AI model needs power, cooling, and connectivity. The bottleneck plays have years of runway."
        },
        {
          "title": "Don't fight the flow.",
          "body": "When 13F filings show institutional accumulation shifting, retail should pay attention — not fight the trend."
        },
        {
          "title": "Selectivity is the edge.",
          "body": "1,817 stocks scanned, 3 survived. The system's value isn't finding winners — it's avoiding the 99.8% that don't qualify."
        }
      ]
    }
  ]
}
